rsid,gene,SNP ID,alleles,what it means,recommendations for (+/+),recommendations for (+/-),recommendations for (-/-),reference,testsrs1800629 ,TNFA,?,"A/A (+/+), A/G (+/-), G/G (-/-) ",The A allele is associated with increased TNF-_ expression and higher circulating levels. ,"Manage stress, get adequate sleep and exercise regularly. Intermittent fasting and fasting mimicking diets have been shown to moderate TNF-alpha. Consider these diets only under medical supervision.","Manage stress, get adequate sleep and exercise regularly. Intermittent fasting and fasting mimicking diets have been shown to moderate TNF-alpha. Consider these diets only under medical supervision.",No recommendations ,Immune Protocol,HsCRP: Adults: < 2.0 mg/L rs33972313,SLC23A1 ,?,"A/A (+/+), A/G (+/-), G/G (-/-) ",Associated with lower circulating vitamin C levels. ,Ensure adequate intake of vitamin C. Dietary sources include citrus fruits and berries. 90 mg/day for adult men and 75 mg/day for adult women is generally adequate to maintain healthy immune function. Your healthcare practitioner will determine whether you need a supplement. ,Ensure adequate intake o fvitamin C.Dietary sources include citrus fruits and berries. 90 mg/day for adult men and 75 mg/day for adult women is generally adequate to maintain healthy immune function. Four to five servings of fruit and vegetables typically provides approximately 200 mg. Higher doses are not necessary on the basis of this SNP alone. Your healthcare practitioner will determine whether you need a supplement. ,No recommendations ,Immune Protocol,Self reported vitamin C intakers10156191 ,DAO,?,"TT (+/+), CT (-/+), CC (-/-)","Associated with reduced activity of diamine oxidase (DAO), an enzyme that breaks down dietary histamine. ","Use additional assessment to confirm the need for a low-histamine diet and/or supplements. Low-histamine diets limit the intake of meats, fermented and canned foods, poultry, fish, tomatoes, chocolate, tomatoes, spinach, eggplant, avocado, and nuts. Ensure adequate intake of micronutrients needed for healthy histamine metabolism, including vitamin B6, B12, vitamin C and zinc. ","Use additional assessment to confirm the need for a low-histamine diet and/or supplements. Low-histamine diets limit the intake of meats, fermented and canned foods, poultry, fish, tomatoes, chocolate, tomatoes, spinach, eggplant, avocado, and nuts. Ensure adequate intake of micronutrients needed for healthy histamine metabolism, including vitamin B6, B12, vitamin C and zinc. ",No recommendations ,Gastrointestinal health protocol,"Serum DAO, Zonulin level (serum) or lactulose/mannitol (urine),  Symptoms following consumption of histamine-rich foods "rs601338 ,FUT2,?,"AA (+/+), GA (-/+), GG (-/-) ",Associated with altered intestinal microbiota composition. ,"Include soluble fiber, yogurt, kefir and/or fermented foods in your diet. If you are sensitive to these foods, your healthcare provider may recommend supplements. ","Include soluble fiber, yogurt, kefir and/or fermented foods in your diet. If you are sensitive to these foods, your healthcare provider may recommend supplements. ",No recommendations ,Gastrointestinal health protocol,"Stool microbial analysis, organic acids"rs4988235 ,MCM6,?,"GG (+/+), AG (-/+), AA (-/-) ",Genetic predisposition to lactose intolerance. ,"If you are lactose intolerant, eliminate dairy foods or opt for lactose-free options. Make sure that you obtain adequate calcium from other sources. ","If you are lactose intolerant, eliminate dairy foods or opt for lactose-free options. Make sure that you obtain adequate calcium from other sources. ",No recommendations ,Gastrointestinal health protocol,"If acute G.I. symptoms following consumption of milk and other dairy foods, rule out dairy allergy"rs4143094 ,GATA3,?,"TT (+/+), GT (-/+), GG (-/-) ",Enhanced colon health benefits with low processed meat intake. ,"To help maintain colon health, focus on reducing intake of processed meats, which include deli meats, sausage, ham and cured bacon. Ensure adequate dietary fiber and vegetable intake. ","To help maintain colon health, focus on reducing intake of processed meats, which include deli meats, sausage, ham and cured bacon. Ensure adequate dietary fiber and vegetable intake. ",No recommendations ,Gastrointestinal health protocol,Self-reported processed meat intake rs4986790 ,TLR4,?,"GG (+/+), AG (-/+), AA (-/-) ",Associated with altered microbial composition in the stomach. ,"Microbial stool test, urea breath test, PCR testing (stool)","Microbial stool test, urea breath test, PCR testing (stool)",No recommendations ,Gastrointestinal health protocol,"PCR testing (stool), Urea breath test"rs1815739 ,ACTN3,?,"TT (+/+), TC (+/-), CC (-/-) ","Individuals with the C allele have a genetic advantage in strength and power-oriented sports that require sprinting or short, intense bursts of activity. The endurance- oriented TT genotype is linked to greater muscle soreness following these types of activities. ","You are likely to perform best in endurance-oriented sports. If you choose to engage in strength/power sports, you may need to train more consistently to achieve a high level of performance. Since you are more likely to experience muscle soreness and/or higher cortisol following intense exercise, it is important to ensure adequate rest and recovery between workouts. Managing daily stress and getting adequate sleep will help to maintain healthy cortisol levels. ",No recommendations ,"You are likely to perform best in strength, power and sprint-type sports. If you choose to participate in endurance events, you may need to train more consistently to achieve a high level of performance. ",Fitness (exercise type),No recommendations rs4343 ,ACE,?,"GG (+/+), GA (+/-), AA (-/-) ","The G allele provides a modest genetic advantage in sports requiring fast-twitch fibers, such as sprinting and weight lifting. Individuals with the A allele are more likely to excel in endurance- oriented sports. ","You are likely to perform best in strength, power and sprint-type sports. If you choose to engage in endurance activities, you may need to train more consistently to achieve a high level of performance.  ",No recommendations ,"You are likely to perform best in endurance-oriented sports. If you choose to engage in strength/power sports, you may need to train more consistently to achieve a high level of performance. ",Fitness (exercise type),No recommendations rs12722 ,COL5A1,?,"TT (+/+), TC (+/-), CC (-/-) ","The CC genotype has a protective effect on tendon and ligament resilience, while the T allele is associated with increased incidence of exercise-related tendon or ligament injury. ","Warm up properly prior to exercise, particularly before plyometrics and uphill running. Include flexibility and mobility exercises for the calves and knees as part of your routine. Use proper technique to minimize unnecessary strain on your tendons and ligaments. ","Warm up properly prior to exercise, particularly before plyometrics and uphill running. Include flexibility and mobility exercises for the calves and knees as part of your routine. Use proper technique to minimize unnecessary strain on your tendons and ligaments. ",No recommendations ,Fitness (injury risk),No recommendations rs1800012 ,COL1A1,?,"GG (+/+), GT (+/-), TT (-/-) ","The TT genotype reduces risk of sports related tendon and ligament injuries, according to a meta- analysis of six case control studies involving 2,314 Caucasian subjects. ","Warm up properly prior to exercise, particularly before plyometrics and uphill running. Include flexibility and mobility exercises for the calves and knees as part of your routine. Use proper technique to minimize unnecessary strain on your tendons and ligaments. ","Warm up properly prior to exercise, particularly before plyometrics and uphill running. Include flexibility and mobility exercises for the calves and knees as part of your routine. Use proper technique to minimize unnecessary strain on your tendons and ligaments. ",No recommendations ,Fitness (injury risk),No recommendations rs679620 ,MMP3,?,"GG (+/+), GA (+/-), AA (-/-)",The G allele has been shown to influence the resilience of the Achilles tendon. ,"Be careful with plyometrics, uphill running, or overextension of the Achilles tendon. Stretch your calf muscles and warm up and cool down properly before and after exercise sessions. ",No recommendations ,No recommendations ,Fitness (injury risk),No recommendations rs1042713 ,ADRB2,?,"AA (+/+), AG (+/-), GG (-/-)","Individuals with the A allele (particularly the AA genotype) tend to experience greater increases in VO2 max with endurance training compared to those with the GG variant. In a study of 316 marathon runners, the A allele was associated with the fastest finishing times. ","You are likely to respond well to endurance training, achieving above-average VO2 max improvements. ","You are likely to respond well to endurance training, achieving above-average VO2 max improvements. ",No recommendations ,Fitness (exercise response),No recommendations rs17602729 ,AMPD1,?,"TT (+/+), TC (+/-), CC (-/-)",The TT genotype is associated with suppressed VO2 max improvements following 20 weeks of aerobic training (3 x 50 min/week at 55_75% maximal heart rate). ,Reduced VO2 max response to endurance training. You may need to train more diligently to achieve a high level of endurance performance. ,No recommendations ,No recommendations ,Fitness (exercise response),No recommendations rs1800588 ,LIPC,?,"TT (+/+), CT (+/-), CC (-/-) ","Exercise typically improves insulin sensitivity, but individual results vary. CC and CT genotypes are likely to experience greater improvements in insulin sensitivity compared to TT carriers. ","If maintaining healthy glucose homeostasis is a clinical goal, regular exercise is likely to result in significant improvements. ","If maintaining healthy glucose homeostasis is a clinical goal, regular exercise is likely to result in significant improvements. ","You are likely to achieve modest improvements in insulin sensitivity with exercise. If maintaining healthy glucose homeostasis is a clinical goal, consider additional strategies to support glucose homeostasis. Your healthcare practitioner may recommend a supplement. ",Fitness (exercise response),No recommendations rs328 ,LPL,?,"GG (+/+), GC (+/-), CC (-/-) ",Individuals with the GG or GC variant are likely to experience greater fat loss with endurance training compared to those with the CC variant.,"You are likely to experience greater fat loss with endurance training based on this genetic marker. If fat loss is an existing goal, consider endurance training as a focus. ","You are likely to experience greater fat loss with endurance training based on this genetic marker. If fat loss is an existing goal, consider endurance training as a focus. ",You are likely to achieve typical fat loss with endurance training. ,Fitness (exercise response),No recommendations rs8192678 ,PPARGC1A,?,"GG (+/+), GA (+/-), AA (-/-) ","The G allele is associated with higher VO2 max, a determinant of endurance capacity. ",Your genotype is associated with higher endurance capacity and may experience above-average performance gains with endurance training.  ,"You are likely to achieve typical or modest improvements in VO2 max through regular aerobic training. Although you lack the genetic advantage associated with the GG genotype, it is unlikely to negatively affect your fitness gains unless you compete at a high level. ","You are likely to achieve typical or modest improvements in VO2 max through regular aerobic training. Although you lack the genetic advantage associated with the GG genotype, it is unlikely to negatively affect your fitness gains unless you compete at a high level. ",Fitness (exercise response),No recommendations 