rsid,gene,SNP ID,alleles,what it means,recommendations for (+/+),recommendations for (+/-),recommendations for (-/-),reference,testsrs234706,CBS,C699T ,"T/T (+/+), C/T (-/+), C/C (-/-) ",Higher conversion of homocysteine to cystathionine,Ensure adequate intake of vitamin B6. A supplement may be recommended.,Ensure adequate intake of vitamin B6. A supplement may be recommended., No recommendations,methylation protocol,"Plasma B6: Adults: 2.1-21.7 ng/mL, Serum homocysteine: CBS activity is inversely associated with homocysteine levels. Men: <11.4 _mol/L, Women: <10.4 _mol/L"rs4680,COMT ,Val158Met ,"Met/Met (+/+), Val/Met (-/+), Val/Val (-/-) ",Reduced detoxification of catecholamines and estrogen. ,"Manage stress with meditation, yoga or breathing exercises. Include vegetables such as broccoli, cauliflower, and Brussels sprouts in your diet to support.   estrogen metabolism. Consider supplement options for hormonal balance and, if applicable, for sleep and relaxation support.","Manage stress with meditation, yoga or breathing exercises. Include vegetables such as broccoli, cauliflower, and Brussels sprouts in your diet to support.   estrogen metabolism. Consider supplement options for hormonal balance and, if applicable, for sleep and relaxation support.", No recommendations,methylation protocol,"Urinary estrogen metabolite ratio (2-OH(E1+E2) / 16_-OHE1): Indicates how effectively a patient methylates estrogens (2-hydroxyestrone to 2-methoxyestrone). Premenopausal, luteal phase women: 0.3-13.7, Postmenopausal women: 0.3-15.1, Men: 0.8-12.9 "rs602662,FUT2,G772A ,"A/A (+/+), G/A (-/+), G/G (-/-) ",Modified risk of low B12 status; potential for lower intestinal microbial diversity. ,"Include yogurt, kefir and fermented foods in your diet.",You may need a vitamin B12 supplement.,You may need a vitamin B12 supplement.,methylation protocol,Serum B12(for -/- only): Adults: 180-914 ng/L rs1801133 ,MTHFR,C677T ,"T/T (+/+), C/T (-/+), C/C (-/-) ",Reduced ability to activate folates to 5-MTHF,"Eat plenty of green, leafy vegetables, which provide folate in a form the body can use.","Eat plenty of green, leafy vegetables, which provide folate in a form the body can use.", No recommendations,methylation protocol,"Serum homocysteine (a useful indicator of overall methylation competence): Men: <11.4 _mol/L, Women: <10.4 _mol/L , RBC Folate: Adults: >280 ng/mL RBC"rs1801131,MTHFR,A1298C ,"C/C (+/+), A/C (-/+), A/A (-/-) ",Reduced ability to activate folates to 5-MTHF,"Eat plenty of green, leafy vegetables, which provide folate in a form the body can use.","Eat plenty of green, leafy vegetables, which provide folate in a form the body can use.", No recommendations,methylation protocol,"Serum homocysteine (a useful indicator of overall methylation competence): Men: <11.4 _mol/L, Women: <10.4 _mol/L , RBC Folate: Adults: >280 ng/mL RBC"rs1805087,MTR ,A2756G ,"G/G (+/+), A/G (-/+), A/A (-/-) ",Potential B12 depletion,You may need a vitamin B12 supplement.,You may need a vitamin B12 supplement., No recommendations,methylation protocol,Methylmalonate (a marker of intracellular levels of B12): Adults: <400 nmol/L rs1801394 ,MTRR,A66G ,"G/G (+/+), A/G (-/+), A/A (-/-) ",Slower regeneration of B12,You may need a vitamin B12 supplements.,You may need a vitamin B12 supplements., No recommendations,methylation protocol,Methylmalonate (a marker of intracellular levels of B12): Adults: <400 nmol/L rs1801198,TCN2,C766G ,"G/G (+/+), C/G (-/+), C/C (-/-) ",Associated with lower levels of bioavailable B12. ,You may need a vitamin B12 supplement.,You may need a vitamin B12 supplement., No recommendations,methylation protocol,Methylmalonate (a marker of intracellular levels of B12): Adults: <400 nmol/L rs7501331,BCM01,A379V ,"T/T (+/+), C/T (-/+), C/C (-/-) ",Reduced ability to convert dietary beta-carotene to active vitamin A. ,"Ensure adequate intake of vitamin A. If you do not eat foods like organ meats, eggs, cod liver oil and dairy products, a supplement may be recommended.","Ensure adequate intake of vitamin A. If you do not eat foods like organ meats, eggs, cod liver oil and dairy products, a supplement may be recommended.", No recommendations,micronutrient protocol,"Serum retinol: Adults: 32.5-78.0 mcg/dL, Serum beta-carotene: Men: 4-51 mcg/dL, Women: 6-77 mcg/dL, NOTE: Both assays are useful as vitamin A status may be low and serum beta-carotene levels may be elevated due to poor conversion to retinol."rs12934922,BCM01,R267S ,"T/T (+/+), A/T (-/+), A/A (-/-) ",Reduced ability to convert dietary beta-carotene to active vitamin A. ,"Ensure adequate intake of vitamin A. If you do not eat foods like organ meats, eggs, cod liver oil and dairy products, a supplement may be recommended. ","Ensure adequate intake of vitamin A. If you do not eat foods like organ meats, eggs, cod liver oil and dairy products, a supplement may be recommended. ", No recommendations,micronutrient protocol,"Serum retinol: Adults: 32.5-78.0 mcg/dL, Serum beta-carotene: Men: 4-51 mcg/dL, Women: 6-77 mcg/dL, NOTE: Both assays are useful as vitamin A status may be low and serum beta-carotene levels may be elevated due to poor conversion to retinol."rs2282679 ,GC,?,"G/G (+/+), T/G (-/+), T/T (-/-) ",Delivery of vitamin D3 to cells may be limited ,You may need extra vitamin D. A supplement may be recommended. ,You may need extra vitamin D. A supplement may be recommended. , No recommendations,micronutrient protocol,25-hydroxy vitamin D3 (an indicator of overall vitamin D status): Adults: 20-100 ng/mL rs11558471 ,SLC30A8 ,?,"A/A (+/+), G/A (-/+), G/G (-/-) ",The A allele may affect zinc requirements. ,Ensure adequate zinc intake.,Ensure adequate zinc intake., No recommendations,micronutrient protocol,"Alkaline phosphatase (a marker of zinc status): Men: 45-115 U/L, Women: 37-144 U/L "rs33972313 ,SLC23A1 ,?,"A/A (+/+), G/A (-/+), G/G (-/-) ",Associated with lower circulating vitamin C levels. ,Ensure adequate intake of vitamin C. Dietary sources include citrus fruits and berries.  90 mg/day for adult men and 75 mg/day for adult women is generally adequate to maintain healthy immune function. A supplement may be recommended. ,Ensure adequate intake of vitamin C. Dietary sources include citrus fruits and berries.  90 mg/day for adult men and 75 mg/day for adult women is generally adequate to maintain healthy immune function. A supplement may be recommended. ,No recommendations ,micronutrient protocol,Self reported vitamin C intakers4680 ,COMT,Val158Met ,"Met/Met (+/+), Val/Met (-/+), Val/Val (-/-) ",Reduced detoxification of catecholamines and estrogen. ,"Manage stress with meditation, yoga or breathing exercises. Include vegetables such as broccoli, cauliflower, and Brussels sprouts in your diet to support estrogen metabolism. Consider supplement options for hormonal balance and, if applicable, for sleep and relaxation support. ","Manage stress with meditation, yoga or breathing exercises. Include vegetables such as broccoli, cauliflower, and Brussels sprouts in your diet to support estrogen metabolism. Consider supplement options for hormonal balance and, if applicable, for sleep and relaxation support. ",No recommendations ,antioxidant and cellular defense protocol,"Urinary estrogen metabolite ratio (2-OH(E1+E2) / 16_-OHE1)*: Indicates how effectively a patient methylates estrogens (2-hydroxyestrone to 2-methoxyestrone). Premenopausal, luteal phase women: 0.3-13.7, Postmenopausal women: 0.3-15.1, Men: 0.8-12.9"rs762551 ,CYP1A2,CYP1A2 or CYP1A2*1F or A-164C or A-163C ,"C/C (+/+), A/C (-/+), A/A (-/-) ","The C allele reduces enzyme function, resulting in slow metabolism of caffeine. This SNP also affects metabolism of certain toxins. ","Limit caffeine intake, as it may exacerbate stress and interfere with sleep. Consider adaptogenic herbs for occasional fatigue. Include raw cruciferous vegetables in the diet to support detoxification. Limit grapefruit juice consumption, which has a mild inhibitory effect on this enzyme. ","Limit caffeine intake, as it may exacerbate stress and interfere with sleep. Consider adaptogenic herbs for occasional fatigue. ",No recommendations ,antioxidant and cellular defense protocol,"Self-reported daily caffeine intake, stress levels and sleep habits. "rs1050450 ,GPx1P1,Pro198Leu ,"T/T (+/+), C/T (-/+), C/C (-/-) ","Reduced capacity to detoxify hydrogen peroxide, a reactive oxygen species. ","Consume a diet rich in fruits and vegetables. Include cruciferous vegetables such as broccoli, Brussels sprouts, arugula, kale and cauliflower. Antioxidant supplements may be recommended. ","Consume a diet rich in fruits and vegetables. Include cruciferous vegetables such as broccoli, Brussels sprouts, arugula, kale and cauliflower. Antioxidant supplements may be recommended. ",No recommendations ,antioxidant and cellular defense protocol,rs1695 ,GSTP1,lle105Val ,"G/G (+/+), A/G (-/+), A/A (-/-) ",Reduced ability to conjugate certain toxins with glutathione. ,"Consume a diet rich in fruits and vegetables. Include cruciferous vegetables such as broccoli, Brussels sprouts, arugula, kale and cauliflower. Supplements to support detoxification may be recommended.","Consume a diet rich in fruits and vegetables. Include cruciferous vegetables such as broccoli, Brussels sprouts, arugula, kale and cauliflower. Supplements to support detoxification may be recommended. ",No recommendations ,antioxidant and cellular defense protocol,noners1800566 ,NQO1,"C609T, Pro187Ser ","T/T (+/+), C/T(-/+), C/C (-/-) ",The T allele is associated with reduced enzyme activity. ,Limit exposure to tobacco smoke. Exercise regularly and consume cruciferous vegetables. ,Limit exposure to tobacco smoke. Exercise regularly and consume cruciferous vegetables. ,No recommendations ,antioxidant and cellular defense protocol,noners4880 ,SOD2,Val16Ala ,"G/G (+/+), A/G (-/+), A/A (-/-) ","Alters the distribution of the SOD2 enzyme (cytosolic vs. mitochondrial), which may compromise antioxidant defenses. ","Studies suggest that higher consumption of foods rich in lycopene and other antioxidants support breast and prostate health in individuals with this genetic variation. Emphasize colorful fruits and vegetables, and include cruciferous vegetables such as broccoli, Brussels sprouts, arugula, kale and cauliflower. ","Studies suggest that higher consumption of foods rich in lycopene and other antioxidants support breast and prostate health in individuals with this genetic variation. Emphasize colorful fruits and vegetables, and include cruciferous vegetables such as broccoli, Brussels sprouts, arugula, kale and cauliflower. ",No recommendations ,antioxidant and cellular defense protocol,rs6265 ,BDNF,"Val66Met, G196A ","Met/Met (+/+), Val/Met (-/+), Val/Val (-/-) ",Associated with deficits in BDNF production. BDNF is important for maintaining mood and cognitive function. ,"Regular exercise is one of the best ways to support your bodys ability to make BDNF. Your diet should include fruits, vegetables and tea, which are rich in polyphenols, and fermented foods such as kefir or yogurt, which provide beneficial bacteria that support natural BDNF production. Include zinc-rich foods such as spinach, nuts, seeds, lean meats and omega-3 fatty acids from fish such as wild salmon, sardines and herring. ","Regular exercise is one of the best ways to support your bodys ability to make BDNF. Your diet should include fruits, vegetables and tea, which are rich in polyphenols, and fermented foods such as kefir or yogurt, which provide beneficial bacteria that support natural BDNF production. Include zinc-rich foods such as spinach, nuts, seeds, lean meats and omega-3 fatty acids from fish such as wild salmon, sardines and herring. ",No recommendations ,mental health and memory protocol,noners4680 ,COMT,Val158Met ,"Met/Met (+/+), Val/Met (-/+), Val/Val (-/-) ",Val: Lower dopamine levels due to faster degradation. Met: Higher dopamine levels due to slower degradation. ,"Consider relaxation techniques, psychotherapy, meditation and music therapy to help support your natural ability to handle stress. Ensure adequate magnesium intake, and minimize or avoid the use of stimulants.","Consider relaxation techniques, psychotherapy, meditation and music therapy to help support your natural ability to handle stress. Ensure adequate magnesium intake, and minimize or avoid the use of stimulants.","Consume adequate protein, which provides amino acid precursors of dopamine and other neurotransmitters. Exercise may also help to support daily cognitive function, alertness and mood. ",mental health and memory protocol,"Self-reported stress levels, sleep satisfaction and mood. "rs6277 ,DRD2,C957T ,"T/T (+/+), C/T (-/+), C/C (-/-) ",The T allele is associated with altered dopamine signaling. This may affect short- term memory performance. ,"Consume a diet high in protein, fiber, whole grains, vegetables and fruits. Emphasize lean meats, poultry, eggs and fish as protein sources, which are rich sources of amino acid precursors of dopamine and other neurotransmitters. Your health care provider will determine whether a supplement is right for you. This SNP may alter the way you respond to antipsychotic agents. ","Consume a diet high in protein, fiber, whole grains, vegetables and fruits. Emphasize lean meats, poultry, eggs and fish as protein sources, which are rich sources of amino acid precursors of dopamine and other neurotransmitters. Your health care provider will determine whether a supplement is right for you. This SNP may alter the way you respond to antipsychotic agents. ",No recommendations ,mental health and memory protocol,rs1801131,MTHFR ,A1298C ,"C/C (+/+), A/C (-/+), A/A (-/-) ",Reduced ability to activate folates to 5-MTHF. ,"Eat plenty of green, leafy vegetables, which provide folate in a form the body can use. ","Eat plenty of green, leafy vegetables, which provide folate in a form the body can use. ",No recommendations ,mental health and memory protocol,"Serum homocysteine (a useful indicator of overall methylation competence): Men: <11.4 _mol/L, Women: <10.4 _mol/L , RBC Folate: Adults: >280 ng/mL RBC"rs1801133 ,MTHFR,C677T ,"T/T (+/+), C/T (-/+), C/C (-/-) ",Reduced ability to activate folates to 5-MTHF. ,"Eat plenty of green, leafy vegetables, which provide folate in a form the body can use. ","Eat plenty of green, leafy vegetables, which provide folate in a form the body can use. ",No recommendations ,mental health and memory protocol,"Serum homocysteine (a useful indicator of overall methylation competence): Men: <11.4 _mol/L, Women: <10.4 _mol/L , RBC Folate: Adults: >280 ng/mL RBC"rs4570625,TPH2,G703T ,"T/T (+/+), G/T (-/+), G/G (-/-) ","This enzyme converts tryptophan to 5-HTP, the precursor of serotonin, which is important for emotional well- being. ","Your diet should emphasize fruits, vegetables, fiber, and adequate protein, all of which provide essential nutrients and phytochemicals that support emotional wellness. Emphasize protein sources such as lean meats and poultry, which are rich in tryptophan, a precursor of serotonin. A supplement may be recommended if other factors indicate the need for mood support.","Your diet should emphasize fruits, vegetables, fiber, and adequate protein, all of which provide essential nutrients and phytochemicals that support emotional wellness. Emphasize protein sources such as lean meats and poultry, which are rich in tryptophan, a precursor of serotonin. A supplement may be recommended if other factors indicate the need for mood support.",No recommendations ,mental health and memory protocol,rs4343 ,ACE,?,"GG (+/+), GA (+/-), AA (-/-) ",Individuals with GG genotypes are more susceptible to the vascular effects of high saturated fat intake (45% of total calories). ,"Limit total fat intake to 30% of total daily calories. Consume saturated fats sparingly. Limit sodium intake to 2,300 mg per day.","Limit total fat intake to 30% of total daily calories. Consume saturated fats sparingly. Limit sodium intake to 2,300 mg per day.",No recommendations ,cardiovascular health protocol,Blood pressure: <120/80 rs699 ,AGT,?,"CC (+/+), CT (+/-), TT (-/-) ","This polymorphism alters plasma AGT levels, with a 10_30% increase among C allele carriers. These individuals may be more sensitive to the effects of dietary sodium on vascular function. ","Limit sodium intake to 2,300 mg per day and maintain adequate intake of potassium-rich foods, such as fruits and vegetables. Aim for a daily potassium intake of 4,700 mg per day. ","Limit sodium intake to 2,300 mg per day and maintain adequate intake of potassium-rich foods, such as fruits and vegetables. Aim for a daily potassium intake of 4,700 mg per day. ",No recommendations ,cardiovascular health protocol,Blood pressure: <120/80 rs1205,CRP,?,"CC (+/+), CT (+/-), TT (-/-) ",Individuals with the C allele (particularly CC genotypes) are predisposed to higher levels of C-reactive protein (CRP). ,"Manage stress, maintain a healthy weight, get adequate sleep and exercise regularly. ","Manage stress, maintain a healthy weight, get adequate sleep and exercise regularly. ",No recommendations ,cardiovascular health protocol,hsCRP: Adults: <2.0 mg/L rs762551 ,CYP1A2,?,"CC (+/+), AC (+/-), AA (-/-) ",C allele carriers metabolize caffeine more slowly and are at greater risk for adverse cardiovascular health effects of moderate to heavy caffeinated coffee consumption (at least 2-3 cups of coffee per day). ,"Be mindful of caffeine intake. Limit caffeinated coffee consumption to a maximum of 2 cups per day. Consider alternatives, such as adaptogenic herbs, for occasional fatigue. ","Be mindful of caffeine intake. Limit caffeinated coffee consumption to a maximum of 2 cups per day. Consider alternatives, such as adaptogenic herbs, for occasional fatigue. ",No recommendations ,cardiovascular health protocol,Blood pressure: <120/80 rs5370 ,EDN1,?,"TT (+/+), TG (+/-), GG (-/-) ","The TT genotype enhances the benefits of regular aerobic exercise on vascular function, while G allele carriers are more likely to exhibit a typical or modest response. ","If maintaining healthy vascular function is a clinical goal, regular aerobic exercise should be a top priority. ","If maintaining healthy vascular function is a clinical goal, regular aerobic exercise should be a top priority. ",No recommendations ,cardiovascular health protocol,Blood pressure: <120/80 rs1801133 ,MTHFR,?,"TT (+/+), TC (+/-), CC (-/-) ","The TT genotype predicts superior response to riboflavin supplementation (1.6 mg/day), which supports vascular relaxation in these individuals. Patients with CT and CC genotypes are less likely to experience this unique benefit. ","Maintain adequate riboflavin (vitamin B2) intake. Good sources of riboflavin include lean meats, eggs and dairy products. Supplementation is recommended if you do not tolerate these foods. ","Maintain adequate riboflavin (vitamin B2) intake. Good sources of riboflavin include lean meats, eggs and dairy products. Supplementation is recommended if you do not tolerate these foods. ",No recommendations ,cardiovascular health protocol,Blood pressure: <120/80 rs662 ,PON1,Q192R ,"CC (+/+), CT (+/-), TT (-/-) ","Paraoxonase-1 (PON1) is an antioxidant enzyme that helps to maintain lipoprotein redox status and cardiovascular health. This polymorphism, known as Q192R, alters its antioxidant activity. ","Consume a polyphenol-rich diet. Major sources of polyphenols that support PON1 include berries, pomegranate juice, tea, red wine. Mediterranean diet constituents, such as nuts, fruits and vegetables, have been effective in supporting this enzyme. Maintain adequate intake of antioxidants (vitamins C, E, beta carotene), selenium and essential fatty acids.","Consume a polyphenol-rich diet. Major sources of polyphenols that support PON1 include berries, pomegranate juice, tea, red wine. Mediterranean diet constituents, such as nuts, fruits and vegetables, have been effective in supporting this enzyme. Maintain adequate intake of antioxidants (vitamins C, E, beta carotene), selenium and essential fatty acids.",No recommendations ,cardiovascular health protocol,Oxidized LDL (serum): <45 U/L (Doctorês Data) rs2016520 ,PPARD,?,"CC (+/+), CT (+/-), TT (-/-) ","In the HERITAGE multicenter clinical study, greater increases in HDL were achieved among CT and CC genotypes following an exercise program. Carriers of the TT variant had a typical response. ","If improving HDL cholesterol is a core objective, make exercise a regular habit, as it is likely to result in significant improvements. ","If improving HDL cholesterol is a core objective, make exercise a regular habit, as it is likely to result in significant improvements. ",You are likely to achieve typical improvements in HDL cholesterol with regular exercise. ,cardiovascular health protocol,HDL-C: Men: 40 mg/dL or below; Women: 50 mg/dL or below rs4149056 ,SLCO1B1,?,"CC (+/+), CT (+/-), TT (-/-) ",The C allele may increase the risk of coenzyme Q10 depletion in individuals receiving statins. ,Consider coenzyme Q10 supplementation if receiving statins. ,Consider coenzyme Q10 supplementation if receiving statins. ,No recommendations ,cardiovascular health protocol,For patients receiving statins: Serum coenzyme Q10: 0.37_2.20 _g/mL rs553668 ,ADRA2a,?,"A/A (+/+), A/G (+/-), G/G (-/-) ","The A allele is associated with increased alpha- adrenergic receptor expression, which may affect insulin release by the pancreas. ","Consider relaxation techniques, meditation or related stress management strategies. ","Consider relaxation techniques, meditation or related stress management strategies. ",No recommendations ,Glucose Homeostasis Protocol,"Fasting glucose: Adults: 70 - 100 mg/dL, HbA1c: Adults: 4.0 _ 5.6%, Serum cortisol: AM: 7 _ 25 mcg/dL, PM: 2 _ 14 mcg/dL "rs7903146 ,TCF7L2,?,"T/T (+/+), T/C (+/-), C/C (-/-) ",The T allele may influence glucose homeostasis.,"Follow a Mediterranean diet or similar, reduce carbohydrate intake, eliminate sugars, and exercise regularly. ","Follow a Mediterranean diet or similar, reduce carbohydrate intake, eliminate sugars, and exercise regularly. ",No recommendations ,Glucose Homeostasis Protocol,"Fasting glucose: Adults: 70 - 100 mg/dL, HbA1c: Adults: 4.0 _ 5.6%"rs11558471 ,SLC30A8 ,?,"A/A (+/+), A/G (+/-), G/G (-/-) ",The A allele may influence glucose homeostasis. Zinc has been shown to modify this effect. ,Ensure adequate zinc intake. ,Ensure adequate zinc intake. ,No recommendations ,Glucose Homeostasis Protocol,"Alkaline phosphatase (a marker of zinc status): Men: 45 _ 115 U/L, Women: 37 _ 144 U/L, Fasting glucose: Adults: 70 - 100 mg/dL, HbA1c: Adults: 4.0 _ 5.6%"rs17366568 ,ADIPOQ,?,,"Associated with low blood levels of adiponectin, a hormone that maintains healthy glucose and lipid metabolism. This relationship has been demonstrated in Caucasians of European descent. Its relevance to other ethnic groups has not been established. ","Omega-3 fatty acids, Alpha lipoic acid,berberine and resveratrol to support glucose homeostasis*, exercise, Mediterranean or plant-based diet emphasizing whole foods, vegetables and healthy fats","Omega-3 fatty acids, Alpha lipoic acid, berberine and resveratrol to support glucose homeostasis*, exercise, Mediterranean or plant-based diet emphasizing whole foods, vegetables and healthy fats",No recommendations ,Metabolic Support Protocol,Serum adiponectin is a useful method to determine a patientês levels and to monitor the effect of diet and lifestyle interventions on metabolic health. Metabolic Xtra should be considered if other testing determines that glucose homeostasis is a clinical objective. rs9939609 ,FTO,?,,"Genetic predisposition to a higher body weight and body fat percentage. This is due, in part, to increased appetite and diminished satiety after meals. Carriers may be more likely to lose weight through diet and lifestyle modifications than non-carriers. ","Increase protein intake, Fucoxanthin and green tea, Whole food diet emphasizing colorful fruits and vegetables, The Mediterranean diet may reduce the impact of the FTO SNP on metabolic health, Adequate sleep to help reduce cravings, Regular exercise","Increase protein intake, Fucoxanthin and green tea, Whole food diet emphasizing colorful fruits and vegetables, The Mediterranean diet may reduce the impact of the FTO SNP on metabolic health, Adequate sleep to help reduce cravings, Regular exercise",No recommendations ,Metabolic Support Protocol,Anthropometric measurements (body weight and body composition). Assess vitamin D levels. Correcting a deficiency may reduce the effect of the SNP on body weight. rs174547 ,FADS,?,,"Diminished capacity to convert omega-3 fatty acid precursors from plant sources (linolenic acid from flaxseed oil, for example) to active omega-3 fatty acids (EPA and DHA). ",EPA and DHA ,EPA and DHA ,No recommendations ,Metabolic Support Protocol,Omega-3 index or similar blood testing is useful for monitoring. The Essential and Metabolic Fatty Acids Analysis RBC (Genova) is recommended. rs5082 ,APOA2,?,,"Associated with increased food intake and weight gain, particularly when saturated fat intake is high. ","Reduce saturated fat intake. In one study, consuming less than 22g/day reduced the effect of this genotype on body weight. ","Reduce saturated fat intake. In one study, consuming less than 22g/day reduced the effect of this genotype on body weight. ",No recommendations ,Metabolic Support Protocol,Anthropometric measurements (body weight and body composition). rs1800795 ,IL-6,?,"G/G (+/+), G/C (+/-), C/C (-/-) ",The G allele is associated with increased production of IL-6 and higher plasma levels. ,"Manage stress, get adequate sleep and exercise regularly. ","Manage stress, get adequate sleep and exercise regularly. ",No recommendations ,Immune Protocol,HsCRP: Adults: < 2.0 mg/L 